{
  "id": "phase13-designated-city-review-queue",
  "phase": 13,
  "status": "in_progress",
  "scope": "designated_city_record_review",
  "promotion_target": "reviewed",
  "quality_gate": [
    "Only source_inventory_complete municipalities may enter the Phase 13 record-review queue.",
    "Every promoted record must retain an official source URL and a record-level evidence location such as page, table, section, or stable HTML locator.",
    "Current plan identity, implementation layer, annual progress, budget state, and settlement state must remain distinct evidence roles.",
    "Proposal, enacted budget, supplementary budget, execution, settlement, project cost, contract amount, and subsidy amount must never be collapsed into one fiscal value.",
    "Target year, reporting year, measurement year, fiscal year, publication year, and plan version must remain separate fields when the source distinguishes them.",
    "Source-reported evaluations may be preserved as source facts but must not become independent Jichi Insight achievement judgments.",
    "No causal attribution or cross-city ranking may be promoted during record review without a separate comparability and methodology review.",
    "Missing or not-yet-published evidence remains explicit and may block a record without downgrading already verified source inventory coverage.",
    "A municipality is not Phase 13 complete until its declared review package passes schema validation, evidence coverage checks, and regression tests."
  ],
  "reference_implementations": [
    {
      "official_code": "401005",
      "name_ja": "北九州市",
      "status": "reviewed_reference",
      "reviewed_data_path": "data/reviewed/kitakyushu-city"
    },
    {
      "official_code": "401307",
      "name_ja": "福岡市",
      "status": "reviewed_reference",
      "reviewed_data_path": "data/reviewed/fukuoka-city"
    }
  ],
  "execution_queue": [
    {
      "sequence": 1,
      "official_code": "011002",
      "name_ja": "札幌市",
      "prefecture_name_ja": "北海道",
      "status": "reviewed_complete",
      "source_inventory_path": "data/indexed/sapporo-city/source_inventory.json"
    },
    {
      "sequence": 2,
      "official_code": "041009",
      "name_ja": "仙台市",
      "prefecture_name_ja": "宮城県",
      "status": "reviewed_complete",
      "source_inventory_path": "data/indexed/sendai-city/source_inventory.json"
    },
    {
      "sequence": 3,
      "official_code": "111007",
      "name_ja": "さいたま市",
      "prefecture_name_ja": "埼玉県",
      "status": "reviewed_complete",
      "source_inventory_path": "data/indexed/saitama-city/source_inventory.json"
    },
    {
      "sequence": 4,
      "official_code": "121002",
      "name_ja": "千葉市",
      "prefecture_name_ja": "千葉県",
      "status": "reviewed_complete",
      "source_inventory_path": "data/indexed/chiba-city/source_inventory.json"
    },
    {
      "sequence": 5,
      "official_code": "141003",
      "name_ja": "横浜市",
      "prefecture_name_ja": "神奈川県",
      "status": "reviewed_complete",
      "source_inventory_path": "data/indexed/yokohama-city/source_inventory.json"
    },
    {
      "sequence": 6,
      "official_code": "141305",
      "name_ja": "川崎市",
      "prefecture_name_ja": "神奈川県",
      "status": "reviewed_complete",
      "source_inventory_path": "data/indexed/kawasaki-city/source_inventory.json"
    },
    {
      "sequence": 7,
      "official_code": "141500",
      "name_ja": "相模原市",
      "prefecture_name_ja": "神奈川県",
      "status": "reviewed_complete",
      "source_inventory_path": "data/indexed/sagamihara-city/source_inventory.json"
    },
    {
      "sequence": 8,
      "official_code": "151009",
      "name_ja": "新潟市",
      "prefecture_name_ja": "新潟県",
      "status": "reviewed_complete",
      "source_inventory_path": "data/indexed/niigata-city/source_inventory.json"
    },
    {
      "sequence": 9,
      "official_code": "221007",
      "name_ja": "静岡市",
      "prefecture_name_ja": "静岡県",
      "status": "reviewed_complete",
      "source_inventory_path": "data/indexed/shizuoka-city/source_inventory.json"
    },
    {
      "sequence": 10,
      "official_code": "221309",
      "name_ja": "浜松市",
      "prefecture_name_ja": "静岡県",
      "status": "review_in_progress",
      "source_inventory_path": "data/indexed/hamamatsu-city/source_inventory.json"
    },
    {
      "sequence": 11,
      "official_code": "231002",
      "name_ja": "名古屋市",
      "prefecture_name_ja": "愛知県",
      "status": "pending_record_review",
      "source_inventory_path": "data/indexed/nagoya-city/source_inventory.json"
    },
    {
      "sequence": 12,
      "official_code": "261009",
      "name_ja": "京都市",
      "prefecture_name_ja": "京都府",
      "status": "pending_record_review",
      "source_inventory_path": "data/indexed/kyoto-city/source_inventory.json"
    },
    {
      "sequence": 13,
      "official_code": "271004",
      "name_ja": "大阪市",
      "prefecture_name_ja": "大阪府",
      "status": "pending_record_review",
      "source_inventory_path": "data/indexed/osaka-city/source_inventory.json"
    },
    {
      "sequence": 14,
      "official_code": "271403",
      "name_ja": "堺市",
      "prefecture_name_ja": "大阪府",
      "status": "pending_record_review",
      "source_inventory_path": "data/indexed/sakai-city/source_inventory.json"
    },
    {
      "sequence": 15,
      "official_code": "281000",
      "name_ja": "神戸市",
      "prefecture_name_ja": "兵庫県",
      "status": "pending_record_review",
      "source_inventory_path": "data/indexed/kobe-city/source_inventory.json"
    },
    {
      "sequence": 16,
      "official_code": "331007",
      "name_ja": "岡山市",
      "prefecture_name_ja": "岡山県",
      "status": "pending_record_review",
      "source_inventory_path": "data/indexed/okayama-city/source_inventory.json"
    },
    {
      "sequence": 17,
      "official_code": "341002",
      "name_ja": "広島市",
      "prefecture_name_ja": "広島県",
      "status": "pending_record_review",
      "source_inventory_path": "data/indexed/hiroshima-city/source_inventory.json"
    },
    {
      "sequence": 18,
      "official_code": "431001",
      "name_ja": "熊本市",
      "prefecture_name_ja": "熊本県",
      "status": "pending_record_review",
      "source_inventory_path": "data/indexed/kumamoto-city/source_inventory.json"
    }
  ],
  "blocked_source_inventories": [],
  "summary": {
    "designated_city_count": 20,
    "reviewed_reference_count": 2,
    "eligible_review_queue_count": 18,
    "blocked_source_inventory_count": 0,
    "reviewed_complete_count": 9,
    "review_in_progress_count": 1,
    "pending_record_review_count": 8,
    "next_official_code": "221309"
  },
  "updated_at": "2026-09-27"
}
